{
  "$schema": "./command-mapping.schema.json",
  "mappingVersion": 1,
  "openuiSpecVersion": "0.12.0",
  "ui": {
    "commands": {
      "reactive-form": {
        "classification": "direct",
        "summary": "Compile an OpenUI Form node into a typed standalone OnPush Angular Material reactive form.",
        "invocation": "ng generate angular-django2:reactive-form",
        "inputs": ["document"],
        "parameters": [
          { "name": "name", "flag": "--name", "type": "string", "positional": 0, "required": true },
          { "name": "definition", "flag": "--definition", "type": "string", "deprecated": true },
          { "name": "document", "flag": "--document", "type": "string" },
          { "name": "nodeId", "flag": "--node-id", "type": "string", "requiresDocument": true },
          { "name": "path", "flag": "--path", "type": "string", "default": "src/app/features" },
          { "name": "project", "flag": "--project", "type": "string" },
          {
            "name": "primitivesPath",
            "flag": "--primitives-path",
            "type": "string",
            "default": "src/app/shared/form-helpers"
          }
        ],
        "onExisting": {
          "outcome": "skip",
          "detail": "Create-only. A second run warns that the output already exists and leaves it unchanged."
        },
        "operations": {
          "create": { "status": "supported" },
          "update": {
            "status": "unsupported",
            "reason": "Create-only: a second run leaves the existing component unchanged.",
            "gap": "shlomoa/angular-django2#194"
          },
          "delete": {
            "status": "unsupported",
            "reason": "There is no delete mode; generated files and their embedding are not removed.",
            "gap": "shlomoa/angular-django2#194"
          },
          "move": {
            "status": "unsupported",
            "reason": "The Change Model does not emit move for the POC; a relocation is reported as delete plus create.",
            "gap": "shlomoa/angular-django2#201"
          }
        },
        "tests": {
          "document": [
            {
              "file": "projects/angular-django-validation/unit/schematics/schematics.reactive-form.spec.ts",
              "ids": [
                "TC-REACTIVE-FORM-OPENUI-01..06",
                "TC-REACTIVE-FORM-OPENUI-DEPRECATION",
                "TC-REACTIVE-FORM-OPENUI-TUTORIAL"
              ]
            }
          ],
          "rerun": [
            {
              "file": "projects/angular-django-validation/unit/schematics/schematics.reactive-form.spec.ts",
              "ids": ["TC-REACTIVE-FORM-09"]
            }
          ]
        },
        "documentSelection": {
          "document": "--document",
          "node": "--node-id",
          "default": "the first node of the accepted type"
        },
        "notes": [
          "--definition (a legacy JSON form definition) is deprecated; the warning prints the equivalent Form node."
        ]
      },
      "form-field": {
        "classification": "direct",
        "summary": "Compile a TextInputs or RangeControl node into a reusable ControlValueAccessor Angular Material form field.",
        "invocation": "ng generate angular-django2:form-field",
        "inputs": ["document", "cli"],
        "parameters": [
          {
            "name": "name",
            "flag": "--name",
            "type": "string",
            "positional": 0,
            "requiredUnlessDocument": true
          },
          {
            "name": "path",
            "flag": "--path",
            "type": "string",
            "default": "src/app/shared/form-helpers"
          },
          { "name": "project", "flag": "--project", "type": "string" },
          {
            "name": "controlType",
            "flag": "--control-type",
            "type": "string",
            "enum": ["text", "email", "password", "number", "textarea"],
            "notWithDocument": true
          },
          {
            "name": "appearance",
            "flag": "--appearance",
            "type": "string",
            "enum": ["fill", "outline"],
            "notWithDocument": true
          },
          {
            "name": "subscriptSizing",
            "flag": "--subscript-sizing",
            "type": "string",
            "enum": ["fixed", "dynamic"],
            "notWithDocument": true
          },
          { "name": "document", "flag": "--document", "type": "string" },
          { "name": "nodeId", "flag": "--node-id", "type": "string", "requiresDocument": true }
        ],
        "onExisting": {
          "outcome": "reject",
          "detail": "A second run fails before modifying existing output."
        },
        "operations": {
          "create": { "status": "supported" },
          "update": {
            "status": "unsupported",
            "reason": "A second run is rejected before it modifies the existing output.",
            "gap": "shlomoa/angular-django2#193"
          },
          "delete": {
            "status": "unsupported",
            "reason": "There is no delete mode; generated files and their embedding are not removed.",
            "gap": "shlomoa/angular-django2#193"
          },
          "move": {
            "status": "unsupported",
            "reason": "The Change Model does not emit move for the POC; a relocation is reported as delete plus create.",
            "gap": "shlomoa/angular-django2#201"
          }
        },
        "tests": {
          "document": [
            {
              "file": "projects/angular-django-validation/unit/schematics/schematics.form-field.spec.ts",
              "ids": ["TC-FORM-FIELD-OPENUI-01..06"]
            }
          ],
          "rerun": [
            {
              "file": "projects/angular-django-validation/unit/schematics/schematics.form-field.spec.ts",
              "ids": ["TC-FORM-FIELD-06"]
            }
          ]
        },
        "documentSelection": {
          "document": "--document",
          "node": "--node-id",
          "default": "the first node of the accepted type"
        }
      },
      "field-component": {
        "classification": "direct",
        "summary": "Compile a TextInputs node into a simple typed Angular Material field-control convenience component.",
        "invocation": "ng generate angular-django2:field-component",
        "inputs": ["document", "cli"],
        "parameters": [
          {
            "name": "name",
            "flag": "--name",
            "type": "string",
            "positional": 0,
            "requiredUnlessDocument": true
          },
          {
            "name": "path",
            "flag": "--path",
            "type": "string",
            "default": "src/app/shared/form-helpers"
          },
          { "name": "project", "flag": "--project", "type": "string" },
          {
            "name": "kind",
            "flag": "--kind",
            "type": "string",
            "enum": ["text", "email", "password", "textarea"],
            "notWithDocument": true
          },
          { "name": "document", "flag": "--document", "type": "string" },
          { "name": "nodeId", "flag": "--node-id", "type": "string", "requiresDocument": true }
        ],
        "onExisting": {
          "outcome": "reject",
          "detail": "A second run fails with 'already exists' before creating files."
        },
        "operations": {
          "create": { "status": "supported" },
          "update": {
            "status": "unsupported",
            "reason": "A second run is rejected before it creates files.",
            "gap": "shlomoa/angular-django2#193"
          },
          "delete": {
            "status": "unsupported",
            "reason": "There is no delete mode; generated files and their embedding are not removed.",
            "gap": "shlomoa/angular-django2#193"
          },
          "move": {
            "status": "unsupported",
            "reason": "The Change Model does not emit move for the POC; a relocation is reported as delete plus create.",
            "gap": "shlomoa/angular-django2#201"
          }
        },
        "tests": {
          "document": [
            {
              "file": "projects/angular-django-validation/unit/schematics/schematics.field-component.spec.ts",
              "ids": ["TC-FIELD-OPENUI-01"]
            }
          ],
          "rerun": [
            {
              "file": "projects/angular-django-validation/unit/schematics/schematics.field-component.spec.ts",
              "match": ["already exists"]
            }
          ]
        },
        "documentSelection": {
          "document": "--document",
          "node": "--node-id",
          "default": "the first node of the accepted type"
        }
      },
      "component": {
        "classification": "direct",
        "summary": "Compile a SurfaceContainers node and its Form, TextInputs and RangeControl children into standalone OnPush components, each embedded in its parent.",
        "invocation": "ng generate angular-django2:component",
        "inputs": ["document", "cli"],
        "parameters": [
          {
            "name": "name",
            "flag": "--name",
            "type": "string",
            "positional": 0,
            "requiredUnlessDocument": true
          },
          { "name": "path", "flag": "--path", "type": "string" },
          { "name": "project", "flag": "--project", "type": "string" },
          { "name": "standalone", "flag": "--standalone", "type": "boolean", "default": true },
          {
            "name": "changeDetection",
            "flag": "--change-detection",
            "type": "string",
            "default": "OnPush"
          },
          { "name": "document", "flag": "--document", "type": "string" },
          { "name": "nodeId", "flag": "--node-id", "type": "string", "requiresDocument": true }
        ],
        "onExisting": {
          "outcome": "reject",